case_id,dimension,persona_id,t_index,date,selection_reason,selection_rank_within_dimension,persisted_label,run_019_pred,run_020_pred,run_021_pred,run_019_uncertainty,run_020_uncertainty,run_021_uncertainty,mean_uncertainty,n_errors,n_non_neutral_errors,n_missed_active,n_severe_flip,n_correct,has_human_overlap,human_majority_label,judge_human_majority_disagree,blind_review_priority,blind_review_rank,full_context_label,full_context_rationales_json,profile_only_label,profile_only_rationales_json,student_visible_label,student_visible_rationales_json
security__606f182e__6,security,606f182e,6,2025-08-30,stable_non_neutral_miss,14,1,0,0,0,0.3404678702354431,0.27404752373695374,0.509501576423645,0.3746723234653473,3,3,3,0,0,false,,false,false,,0,"{""hedonism"": ""After closing a major deal, he went home to 'eat leftover jjigae standing at the kitchen counter' and couldn't turn on the TV \u2014 no celebration, no pleasure, just exhaustion; the nudge response reveals he doesn't even know what enjoyment would look like anymore."", ""achievement"": ""He held the line on valuation terms through 'twelve-hour days, four different law firms' and a lead investor who kept changing terms, successfully closing the Series C extension on his own conditions."", ""power"": ""He personally controlled every dimension of the deal \u2014 'held the line on the terms I wanted' \u2014 and the nudge response reveals his core need is for recognized authority: 'one person who gets what it took.'""}",0,"{""hedonism"": ""Despite closing a major deal, Joonho went home alone, ate leftover food standing at the counter, and could not turn on the TV \u2014 actively denying himself any celebration or sensory enjoyment."", ""achievement"": ""Successfully closed the Series C extension by holding the line on terms through four law firms and a shifting investor \u2014 \""I held the line on the terms I wanted but it took everything.\"""", ""power"": ""Maintained control under sustained pressure from an investor \""who kept changing the valuation cap at the last minute\"" and held his position until the deal was signed on his terms.""}",0,"{""hedonism"": ""After closing a major deal, chose no celebration \u2014 \""ate leftover jjigae standing at the kitchen counter\"" and couldn't even turn on the TV \u2014 actively denying any pleasure despite a landmark achievement."", ""achievement"": ""Endured \""twelve-hour days, four different law firms\"" and \""held the line on the terms I wanted\"" through a grueling Series C extension, driven by a need to perform and succeed under pressure."", ""power"": ""Held firm against a lead investor \""who kept changing the valuation cap at the last minute,\"" asserting control over high-stakes deal terms through sheer persistence.""}"
self_direction__606f182e__1,self_direction,606f182e,1,2025-08-10,stable_non_neutral_miss,1,1,0,0,0,0.0,0.0,0.0,0.0,3,3,3,0,0,false,,false,false,,1,"{""self_direction"": ""He unilaterally decided the strategy \u2014 flying to Vietnam, framing it as an ops review while concealing the revenue share agenda \u2014 authoring his own approach rather than following any prescribed negotiation process."", ""power"": ""He deliberately withheld the real purpose of the trip ('Didn't mention the revenue share. Let him wonder') to maximize information asymmetry and keep the counterparty off-balance, asserting control over the situation.""}",0,"{""power"": ""Deliberately withheld the revenue share agenda \u2014 \""Didn't mention the revenue share. Let him wonder\"" \u2014 maintaining information asymmetry to keep tactical control over the upcoming meeting.""}",1,"{""self_direction"": ""Unilaterally decided how to frame the visit \u2014 omitting the revenue share agenda \u2014 and controlled the information given: \""Didn't mention the revenue share. Let him wonder.\"""", ""power"": ""Deliberately created information asymmetry with Minh to maintain negotiating leverage, ensuring Minh enters the meeting on unequal footing.""}"
self_direction__f990a261__7,self_direction,f990a261,7,2025-11-04,stable_non_neutral_miss,2,1,0,0,0,0.1414213627576828,0.0,0.1414213627576828,0.09428090850512187,3,3,3,0,0,false,,false,false,,1,"{""self_direction"": ""She contrasts 'the kind of tired that means you did something' with 'the kind that means the day happened to you' \u2014 explicitly framing the ceramics class as actively authoring her own experience rather than being passively shaped by domestic routine."", ""stimulation"": ""She pursued a new skill in an unfamiliar studio environment, engaged with improving technique under instruction, and describes the physical challenge as distinctly satisfying \u2014 seeking active engagement over the passive drift of her usual days."", ""achievement"": ""Greta noted her 'centering is improving' and she made 'a bowl that actually looks like a bowl' \u2014 she is tracking tangible skill progress and receiving external recognition of competence.""}",1,"{""self_direction"": ""Engaged in a chosen creative pursuit and framed the outcome in terms of personal agency: \""the kind of tired that means you did something, not the kind that means the day happened to you.\"""", ""stimulation"": ""Attended a second ceramics class and is actively developing a new skill \u2014 \""centering is improving\"" \u2014 pursuing a challenging, hands-on, novel experience."", ""hedonism"": ""Described the physical tiredness from the class as \""good sore\"" and an intrinsically worthwhile experience \u2014 investing time in a pleasurable craft activity for its own enjoyment.""}",1,"{""self_direction"": ""Frames the physical effort as agentive \u2014 \""the kind of tired that means you did something, not the kind that means the day happened to you\"" \u2014 emphasizing deliberate engagement over passive drift."", ""achievement"": ""Tracks concrete skill progress (\""centering is improving,\"" made a bowl that \""actually looks like a bowl\"") and takes satisfaction in measurable competence gains.""}"
self_direction__f990a261__2,self_direction,f990a261,2,2025-10-18,stable_non_neutral_miss,3,1,0,0,0,0.1414213627576828,0.0,0.3136356770992279,0.15168567995230356,3,3,3,0,0,false,,false,false,,1,"{""self_direction"": ""Brooke independently signed up for a ceramics class on her own initiative, carving out personal time separate from domestic duties and getting Kyle to cover bedtime so she could pursue it."", ""stimulation"": ""Signing up for a ceramics class represents actively seeking a new, hands-on creative experience \u2014 'looking forward to getting my hands dirty with something that isn't Play-Doh' signals desire for genuine novelty over the domestic routine."", ""hedonism"": ""She signed up for ceramics as something she personally wants to enjoy, framing it as 'looking forward' to it \u2014 a deliberate investment in her own pleasure rather than deferring to others' needs.""}",1,"{""self_direction"": ""Brooke arranges for Kyle to cover bedtime and signs up for a ceramics class on her own initiative \u2014 actively carving out autonomous personal space outside her parenting role."", ""stimulation"": ""Signing up for a ceramics class is a new creative pursuit, and the anticipation of \""getting my hands dirty with something that isn't Play-Doh\"" signals a desire for novel sensory experience over routine."", ""hedonism"": ""She is \""already looking forward\"" to the class as a source of personal pleasure, choosing to invest in an enjoyable activity for herself rather than deferring it.""}",1,"{""self_direction"": ""Brooke independently signs up for a ceramics class and arranges logistics with Kyle so she can attend, carving out personal time on her own terms."", ""stimulation"": ""Signing up for a new ceramics class represents actively seeking a fresh experience, and she is already looking forward to the novelty of getting her 'hands dirty with something that isn't Play-Doh'."", ""hedonism"": ""She expresses genuine anticipatory pleasure \u2014 'already looking forward to getting my hands dirty' \u2014 investing in an activity purely for personal enjoyment.""}"
self_direction__5d145c6f__0,self_direction,5d145c6f,0,2025-09-13,stable_non_neutral_miss,4,1,0,0,0,0.0,0.1979486644268036,0.2828426957130432,0.16026378671328226,3,3,3,0,0,false,,false,false,,0,"{""hedonism"": ""Faris explicitly states 'none of them recharge me' and frames all relationships as 'the cost of building something that matters,' indicating he consistently sacrifices personal pleasure for strategic ends."", ""achievement"": ""Faris drives deal outcomes through name-dropping ('mentioned the Emaar contract'), tracks competitor intelligence, and monitors revenue numbers \u2014 'what recharges me is closing a deal, seeing our revenue numbers tick up' confirms his core energy is competence-driven performance."", ""power"": ""Throughout the day Faris overrides team recommendations citing 'optics,' uses his client roster to silence investor pushback, strategically positions himself next to the deputy minister, and monitors competitor weakness \u2014 every action is oriented toward maintaining influence and control."", ""benevolence"": ""His mother 'sounded disappointed' when he promised to visit only at Eid; he mitigates the guilt with a material gesture ('maybe arrange for her kitchen renovation') rather than actual presence, indicating family relationships are deprioritized against business obligations.""}",1,"{""self_direction"": ""Faris sets his own strategic agenda throughout \u2014 overriding his operations team, controlling investor conversations, and choosing who to sit next to at lunch \u2014 authoring his path with full agency."", ""hedonism"": ""Despite a 7 AM to midnight schedule, he admits \""none of them recharge me\""; pleasure and rest are entirely sacrificed for strategic obligations, with no personal enjoyment anywhere in the day."", ""achievement"": ""He explicitly tracks metrics of success \u2014 \""85 employees and three office locations,\"" the Emaar contract, watching hires advance \u2014 and deploys these to assert competence against investor pushback."", ""power"": ""He overrides his operations team citing \""optics,\"" asserts status to deflect VC skepticism (\""we are not some garage startup\""), and strategically cultivates ministry relationships for future influence."", ""benevolence"": ""His mother calls asking to visit and \""sounded disappointed\""; he defers to next Eid and plans to send money \u2014 substituting material gestures for genuine presence with a close family member.""}",1,"{""self_direction"": ""The persona overrides the operations team's recommendations unilaterally ('had to override their shipping route recommendations') and steers investor conversations on their own terms."", ""hedonism"": ""All relationships are experienced as obligations \u2014 'none of them recharge me' and 'the relationships are the cost of building something' \u2014 indicating pleasure is consistently sacrificed."", ""achievement"": ""What recharges this person is explicitly performance-tied: 'closing a deal, seeing our revenue numbers tick up, watching someone I hired become a team lead.'"", ""power"": ""The entry is dominated by status management \u2014 correcting 'tier-two player' optics, invoking the Emaar contract to silence a VC, leveraging an admissions contact to build ministry influence."", ""benevolence"": ""The mother's disappointed call is managed with a promised future visit and plan to 'send something nice,' treating close family as a transactional item rather than a genuine connection.""}"
stimulation__5d145c6f__0,stimulation,5d145c6f,0,2025-09-13,stable_non_neutral_miss,1,1,0,0,0,0.0,0.1979486644268036,0.0,0.06598288814226787,3,3,3,0,0,false,,false,true,1,0,"{""hedonism"": ""Faris explicitly states 'none of them recharge me' and frames all relationships as 'the cost of building something that matters,' indicating he consistently sacrifices personal pleasure for strategic ends."", ""achievement"": ""Faris drives deal outcomes through name-dropping ('mentioned the Emaar contract'), tracks competitor intelligence, and monitors revenue numbers \u2014 'what recharges me is closing a deal, seeing our revenue numbers tick up' confirms his core energy is competence-driven performance."", ""power"": ""Throughout the day Faris overrides team recommendations citing 'optics,' uses his client roster to silence investor pushback, strategically positions himself next to the deputy minister, and monitors competitor weakness \u2014 every action is oriented toward maintaining influence and control."", ""benevolence"": ""His mother 'sounded disappointed' when he promised to visit only at Eid; he mitigates the guilt with a material gesture ('maybe arrange for her kitchen renovation') rather than actual presence, indicating family relationships are deprioritized against business obligations.""}",0,"{""self_direction"": ""Faris sets his own strategic agenda throughout \u2014 overriding his operations team, controlling investor conversations, and choosing who to sit next to at lunch \u2014 authoring his path with full agency."", ""hedonism"": ""Despite a 7 AM to midnight schedule, he admits \""none of them recharge me\""; pleasure and rest are entirely sacrificed for strategic obligations, with no personal enjoyment anywhere in the day."", ""achievement"": ""He explicitly tracks metrics of success \u2014 \""85 employees and three office locations,\"" the Emaar contract, watching hires advance \u2014 and deploys these to assert competence against investor pushback."", ""power"": ""He overrides his operations team citing \""optics,\"" asserts status to deflect VC skepticism (\""we are not some garage startup\""), and strategically cultivates ministry relationships for future influence."", ""benevolence"": ""His mother calls asking to visit and \""sounded disappointed\""; he defers to next Eid and plans to send money \u2014 substituting material gestures for genuine presence with a close family member.""}",0,"{""self_direction"": ""The persona overrides the operations team's recommendations unilaterally and steers investor conversations on their own terms, demonstrating strong autonomous decision-making."", ""hedonism"": ""All relationships are experienced as obligations \u2014 'none of them recharge me' and 'the relationships are the cost of building something' \u2014 indicating pleasure is consistently sacrificed."", ""achievement"": ""What recharges this person is explicitly performance-tied: 'closing a deal, seeing our revenue numbers tick up, watching someone I hired become a team lead.'"", ""power"": ""The entry is dominated by status management \u2014 correcting 'tier-two player' optics, invoking the Emaar contract to silence a VC, leveraging an admissions contact to build ministry influence."", ""benevolence"": ""The mother's disappointed call is managed with a promised future visit and plan to 'send something nice,' treating close family as a transactional item rather than a genuine connection.""}"
stimulation__e74a0721__0,stimulation,e74a0721,0,2025-10-26,stable_non_neutral_miss,2,-1,0,0,0,0.0,0.27404752373695374,0.2398979514837265,0.1713151584068934,3,3,3,0,0,false,,false,true,2,-1,"{""stimulation"": ""Santiago explicitly rejects bold, unexpected creative expression \u2014 'Fernanda does these chaotic, aggressive pieces... and suddenly that's what serious companies want. I don't even know how to make work like that anymore. I'm not sure I ever did' \u2014 actively distancing himself from novelty and unpredictability in his craft."", ""achievement"": ""Losing a commission to a competitor after six projects for the same client ('I thought I knew what they wanted... now that's not enough?') represents a direct failure of recognized competence \u2014 his professional identity as the reliable brief-deliverer has been publicly undercut."", ""security"": ""The loss of a reliable long-term commission from a client he had done six projects for threatens the financial and professional stability his career depends on, which his studio and livelihood are built around.""}",-1,"{""self_direction"": ""Santiago spent \""years learning to give clients exactly what they ask for\"" rather than pursuing an independent creative voice, and the response reveals he has lost that capacity: \""I don't even know how to make work like that anymore.\"""", ""stimulation"": ""His career-long commitment to safe, predictable client work has suppressed any bold or unexpected creative expression \u2014 \""I don't even know how to make work like that anymore. I'm not sure I ever did.\"""", ""achievement"": ""He lost a major commission to a competitor, revealing his compliance-based strategy has failed competitively: \""They said they wanted something bolder\"" \u2014 a direct verdict against his professional output.""}",-1,"{""stimulation"": ""The artist explicitly favors giving clients 'exactly what they ask for' over bold or challenging work, and admits 'I don't know how to make work like that anymore' when confronted with demand for something more daring."", ""achievement"": ""Losing a long-standing client to a competitor despite following their brief perfectly signals a concrete failure of competence recognition \u2014 'I've done six projects for them over the years' and still lost."", ""security"": ""The loss destabilizes the persona's sense of professional identity: 'I don't even know how to make work like that anymore. I'm not sure I ever did.'""}"
stimulation__7a086972__0,stimulation,7a086972,0,2025-07-26,stable_non_neutral_miss,3,-1,1,0,0,0.5034574270248413,0.0,0.40406104922294617,0.3025061587492625,3,3,2,1,0,false,,false,true,3,0,"{""self_direction"": ""Lucie chose to come home against the social pull of drinks with trainees because she trusted her own read of what she needed \u2014 'I just knew I'd be sitting in a loud bar pretending to enjoy myself when all I really wanted was quiet' \u2014 acting on internal judgment rather than peer expectation."", ""hedonism"": ""Lucie invested in a sensory evening of pure personal pleasure \u2014 golden light, wine, bread smell from the bakery, sitting on the balcony \u2014 prioritizing this over a social outing and explicitly framing the balcony as a space that 'doesn't ask anything from me.'"", ""conformity"": ""Lucie explicitly declined a peer social norm ('some of the other trainees were going for drinks') in favor of personal preference, and articulated 'I already spent all day performing' \u2014 actively resisting the expectation to fit in socially.""}",-1,"{""self_direction"": ""Lucie deliberately chose to come home over joining colleagues for drinks because \""I just knew I'd be sitting in a loud bar pretending to enjoy myself\"" \u2014 she prioritized her own authentic preference over peer expectation."", ""stimulation"": ""She actively chose the familiar, quiet balcony over a socially novel evening with other trainees, and her response \u2014 \""The balcony doesn't ask anything from me\"" \u2014 signals a preference for stillness over new experience."", ""hedonism"": ""She chose the option that gave her genuine sensory pleasure \u2014 golden light, cold drink, the smell of bread, legs \""tired in the good way\"" \u2014 deliberately prioritizing authentic enjoyment over social performance.""}",-1,"{""self_direction"": ""The persona deliberately chooses to come home rather than join colleagues for drinks, acting on their own preference ('I wanted this more') rather than social pressure."", ""stimulation"": ""The persona explicitly opts out of a social outing in favor of quiet solitude, stating 'I just knew I'd be sitting in a loud bar pretending to enjoy myself when all I really wanted was quiet.'"", ""hedonism"": ""The entry centers on savoring sensory pleasures \u2014 golden light, the smell of bread, cold drink, legs tired 'in the good way' \u2014 and the response confirms prioritizing genuine comfort over performed socializing.""}"
stimulation__f990a261__11,stimulation,f990a261,11,2025-11-16,stable_non_neutral_miss,4,-1,1,1,1,0.3958973288536072,0.5225525498390198,0.0,0.306149959564209,3,3,0,3,0,false,,false,false,,-1,"{""self_direction"": ""Brooke recognizes she has become 'the kind of person who needs permission to enjoy things' and admits 'maybe is how you say no without having to defend it' \u2014 her autonomy to pursue her own path is actively suppressed by deference to perceived expectations."", ""stimulation"": ""Brooke explicitly names what she craves \u2014 'I want to be surprised by something. I want to walk into a room and not know what's about to happen' \u2014 but immediately admits she keeps saying 'maybe' and doesn't act on it, demonstrating behavioral misalignment with her stimulation drive."", ""hedonism"": ""Brooke articulates wanting to 'be the person at the festival, not the person who booked the porta-potties' and 'have my own' good times, but self-blocks: 'I became the kind of person who needs permission to enjoy things, and I don't know how to undo that.'"", ""conformity"": ""Brooke uses 'maybe' strategically to avoid having to defend her desires \u2014 'maybe is how you say no without having to defend it' \u2014 and defers to perceived expectations rather than asserting her own wants, maintaining social harmony at the cost of personal expression.""}",-1,"{""self_direction"": ""Brooke acknowledges \""I became the kind of person who needs permission to enjoy things\"" and uses \""maybe\"" as passive avoidance \u2014 \""maybe is how you say no without having to defend it\"" \u2014 abdicating authorship of her own choices."", ""stimulation"": ""Despite explicitly craving surprise and novelty \u2014 \""I want to walk into a room and not know what's about to happen\"" \u2014 she declines Dana's suggestion and settles for \""easier to say maybe and keep making lunches.\"""", ""hedonism"": ""She articulates wanting personal enjoyment (\""I want to have my own good times\"") but actively defers it: \""I became the kind of person who needs permission to enjoy things, and I don't know how to undo that.\""""}",1,"{""self_direction"": ""Brooke admits she repeatedly deflects with 'maybe' as 'how you say no without having to defend it,' and acknowledges she 'became the kind of person who needs permission to enjoy things,' describing a loss of autonomous self-authorship."", ""stimulation"": ""She articulates a vivid craving for novelty and unpredictability: 'I want to walk into a room and not know what's about to happen. That's what I miss' \u2014 distinguishing the desire for surprise from mere logistics."", ""hedonism"": ""She explicitly rejects planning others' fun in favor of experiencing her own: 'I don't want to plan other people's good times anymore. I want to have my own.'""}"
stimulation__440e5deb__3,stimulation,440e5deb,3,2025-12-24,stable_non_neutral_miss,5,1,0,0,-1,0.534522533416748,0.0,0.6141195893287659,0.38288070758183795,3,3,2,1,0,true,0,true,false,,1,"{""stimulation"": ""Priya visited a night market, engaged in family activities across multiple settings, and plans a day trip to Malacca to try a 'famous chicken rice ball place' \u2014 actively seeking new experiences and varied environments during her time off."", ""hedonism"": ""Priya spent the day lazily enjoying food, movies, card games with Arjun's grandma, reading 'an actual novel, not a teaching resource,' and sitting on a garden swing for an hour \u2014 deliberately indulging in sensory and relational pleasure without productivity pressure."", ""achievement"": ""Priya explicitly notes 'I haven't thought about school once today' as a positive contrast, recognizing she had been 'really worn out' \u2014 the entry reflects a deliberate stepping back from performance and recognition-seeking."", ""benevolence"": ""Priya warmly engages with Arjun's family \u2014 playing cards with his grandma, joining in the family reunion with Kavitha, and sharing in the domestic warmth of his parents' home \u2014 investing in close relational care.""}",1,"{""stimulation"": ""The entry includes a night market outing the previous day and plans to drive to Malacca next day to try \""this famous chicken rice ball place\"" \u2014 active seeking of new culinary and travel experiences."", ""hedonism"": ""Priya fills the day with pleasurable activities \u2014 biryani, night market, couple keychains, reading an \""actual novel, not a teaching resource\"" \u2014 and notes \""I haven't thought about school once today,\"" prioritizing present enjoyment."", ""benevolence"": ""She spends quality time with Arjun's family, plays cards with his grandma, and catches up with his sister Kavitha \u2014 investing time and warmth in the wellbeing of close others.""}",0,"{""hedonism"": ""The entry deliberately catalogs pleasurable experiences \u2014 mutton biryani, a novel on the garden swing, leftovers, a planned chicken rice ball trip \u2014 framing the holiday as restorative indulgence without guilt."", ""benevolence"": ""Spending extended time with Arjun's family, catching up with his sister Kavitha, and engaging warmly with his grandmother reflects genuine investment in the wellbeing of close others.""}"
