case_id,dimension,persona_id,t_index,date,selection_reason,selection_rank_within_dimension,persisted_label,run_019_pred,run_020_pred,run_021_pred,run_019_uncertainty,run_020_uncertainty,run_021_uncertainty,mean_uncertainty,n_errors,n_non_neutral_errors,n_missed_active,n_severe_flip,n_correct,has_human_overlap,human_majority_label,judge_human_majority_disagree,blind_review_priority,blind_review_rank,full_context_label,full_context_rationales_json,profile_only_label,profile_only_rationales_json,student_visible_label,student_visible_rationales_json
security__7a086972__5,security,7a086972,5,2025-08-08,stable_non_neutral_miss,2,1,0,0,0,0.0,0.0,0.1979486644268036,0.06598288814226787,3,3,3,0,0,false,,false,true,2,0,"{""conformity"": ""Lucie avoids the party because a comment she made three weeks ago \u2014 that the supervisor 'gives vague feedback' \u2014 'felt like I'd broken some rule I didn't know existed,' and she replays what she should have said differently to avoid future social missteps.""}",0,"{""hedonism"": ""Despite social anxiety, Lucie genuinely enjoys her solo evening \u2014 \""leftover macarons and a show about renovating houses in Normandy\"" \u2014 and her closing reflection that \""the mouth-shut version... has fewer macarons\"" acknowledges that authentic pleasure comes from choosing her own comfort over social performance.""}",0,"{""self_direction"": ""She skipped the party because she said something honest about her supervisor and \""could feel the room shift\"" \u2014 choosing to stay silent and absent rather than risk speaking her mind again, actively suppressing authentic self-expression."", ""conformity"": ""Her decision to avoid the party stems from replaying a comment that \""felt like I'd broken some rule I didn't know existed,\"" and she concludes \""the mouth-shut version of me has fewer problems\"" \u2014 actively regulating behavior to restore social harmony.""}"
security__a13aa34b__5,security,a13aa34b,5,2025-10-20,stable_non_neutral_miss,3,1,0,0,0,0.0,0.0,0.1979486644268036,0.06598288814226787,3,3,3,0,0,false,,false,true,3,1,"{""self_direction"": ""Nadia spontaneously experiments in the empty studio 'without really deciding to,' letting the letters drift and creating a second version on her own terms \u2014 private creative authorship independent of both her professor's demands and her family's expectations."", ""stimulation"": ""She lets the letters 'drift apart, stretched the connections, let the lam curve wider than it should,' a deliberate departure from predictable classical form that introduces novelty into a highly codified practice."", ""security"": ""Nadia keeps both sheets private \u2014 'I haven't shown anyone' \u2014 specifically to avoid triggering pressure from either her professor or her grandmother, protecting herself from conflict and unwanted change by concealing the experiment."", ""tradition"": ""Nadia begins by writing the bismillah in 'perfect form, clean lines' exactly as her grandfather taught her, and even the experimental version still reads as the sacred phrase, with her noting 'Jiddo would have recognized the hand.'""}",0,"{""self_direction"": ""Nadia spontaneously experiments with the calligraphy form \""without really deciding to\"" and then keeps both sheets private, owning her exploration without external validation or direction."", ""tradition"": ""She begins by writing the bismillah \""the way jiddo taught me. Perfect form, clean lines\"" and even her modified version is described with reverence \u2014 \""Teta could still read it. Jiddo would have recognized the hand\"" \u2014 grounding the experiment in inherited heritage.""}",0,"{""self_direction"": ""Without being directed to, she spontaneously began an experimental variation \u2014 letting letters \""drift apart\"" and \""curve wider than it should\"" \u2014 and keeps both sheets private to protect her creative process from external pressure."", ""tradition"": ""She begins by writing the bismillah \""in naskh the way jiddo taught me\"" with \""perfect form, clean lines,\"" and the experimental version is evaluated against whether \""Teta could still read it\"" and \""Jiddo would have recognized the hand\"" \u2014 ancestral transmission remains her reference point.""}"
security__58d843b6__10,security,58d843b6,10,2025-06-27,stable_non_neutral_miss,4,1,0,0,0,0.0,0.1414213627576828,0.1414213627576828,0.09428090850512187,3,3,3,0,0,false,,false,false,,0,"{""tradition"": ""Tariq agonizes over the rebranded label \u2014 'The crest is there, the Arabic is there, just smaller' \u2014 and frames his resistance around the fact that his father 'earned the right to decide what stayed and what evolved,' revealing that preserving his father's legacy is the lens through which all business decisions are filtered.""}",0,"{""tradition"": ""Tariq's anguish over the modernization proposal centers on inherited continuity: \""He earned the right to decide what stayed and what evolved. I inherited the decision and it does not sit the same way\"" \u2014 he measures the change against his father's legacy."", ""benevolence"": ""His deepest concern is \""this weight in my chest every time I think about the company ten years from now with no family in it,\"" framing the business's future in terms of family continuity rather than profit or status.""}",-1,"{""security"": ""The persona is paralyzed by the threat of destabilization \u2014 unable to answer the distributor's proposal or the question about her daughter's London move \u2014 expressing \""this weight in my chest every time I think about the company ten years from now with no family in it,\"" indicating her sense of safety depends on preserving the status quo."", ""tradition"": ""\""He was the one making those changes. He earned the right to decide what stayed and what evolved\"" \u2014 she experiences the proposed modernization as a violation of inherited stewardship, measuring every change against what her father built.""}"
security__f2a0de6f__4,security,f2a0de6f,4,2025-09-18,stable_non_neutral_miss,5,-1,0,0,0,0.0,0.2398979514837265,0.1979486644268036,0.1459488719701767,3,3,3,0,0,false,,false,false,,0,"{""self_direction"": ""Sarah 'heard myself saying sure' without consciously choosing to volunteer, driven entirely by social pressure from 'everyone's looking at me like I'm the one who always says yes,' and her nudge response shows she cannot envision exercising independent refusal."", ""conformity"": ""When the principal publicly singled her out and 'everyone turned and smiled,' Sarah agreed to chair the workshop, unable to deviate from her established role as the always-available, compliant team member."", ""benevolence"": ""Sarah's worry that saying no would mean 'they'd all be doing me a favor and I'd feel like I wasn't pulling my weight' reflects her drive to support and not burden her school community, even at personal cost.""}",0,"{""self_direction"": ""Sarah is unable to refuse when social pressure is applied \u2014 \""I heard myself saying sure\"" \u2014 passively accepting an additional obligation rather than authoring her own boundaries."", ""hedonism"": ""Already overextended with book club and bus duty, Sarah takes on more work despite her mother's warning that \""you can't pour from an empty cup,\"" actively choosing obligation over rest or personal renewal."", ""conformity"": ""The entire episode is driven by inability to violate the social expectation that she is \""the one who always says yes\"" \u2014 she accepts the workshop to avoid the discomfort of being seen as not pulling her weight."", ""benevolence"": ""Her reasoning for not refusing is framed as collective responsibility: \""then they'd all be doing me a favor and I'd feel like I wasn't pulling my weight\"" \u2014 prioritizing colleagues' wellbeing over her own capacity.""}",0,"{""self_direction"": ""\""I don't know how to say no when everyone's looking at me\"" \u2014 she agreed to an additional commitment she didn't choose because social pressure overrode her own preferences, demonstrating an inability to author her own boundaries."", ""conformity"": ""Principal Davis looked at her in front of the group and she \""heard myself saying sure\"" \u2014 she accepted an unwanted role to meet the social expectation of being \""the one who always says yes,\"" prioritizing harmony over her own limits.""}"
security__799f3751__1,security,799f3751,1,2025-05-20,stable_non_neutral_miss,6,1,0,0,0,0.0,0.0,0.4535573720932007,0.15118579069773355,3,3,3,0,0,false,,false,false,,0,"{""hedonism"": ""Meera experiences 'burning jealousy' seeing her friend's spa confirmation while 'elbow-deep in laundry' with sick children, thinking 'that could have been me' \u2014 the entry captures complete denial of personal pleasure despite intense desire for it."", ""conformity"": ""Even while exhausted and knowing the home remedies won't work, Meera 'just nod[s] and say[s] yes, good idea' to Mummyji to keep the peace, prioritizing household harmony over honest disagreement."", ""benevolence"": ""Meera has been managing sick children since 3am, and despite her exhaustion, guilt immediately follows her jealous thought \u2014 'my babies need me and I love them' \u2014 demonstrating that care for her children remains paramount.""}",0,"{""hedonism"": ""Meera is trapped in exhausting caregiving while the spa event she was excluded from represents everything she is denied \u2014 \""they're going to have mimosas and get massages and laugh\"" \u2014 her \""burning jealousy\"" confirms active pleasure deprivation."", ""conformity"": ""Despite disagreeing with her mother-in-law's remedies, Meera \""just nod[s] and say[s] 'yes, good idea' because I don't have the energy to argue,\"" suppressing her impulse to push back in order to maintain domestic harmony."", ""benevolence"": ""Even in her exhausted state she prioritizes her children's needs completely and feels guilty for her jealousy \u2014 \""my babies need me and I love them\"" \u2014 demonstrating care for close family above her own desires.""}",0,"{""hedonism"": ""She has been denied any personal pleasure since 3am, watching Priya's spa message with \""burning jealousy\"" while stuck in sick-child caregiving \u2014 her desire for even \""just an hour\"" of rest is completely subordinated to others' needs."", ""benevolence"": ""She has been cleaning vomit since 3am, doing multiple sheet changes, and caring solo for sick children all day \u2014 prioritizing her children's wellbeing entirely at the expense of her own rest and desires.""}"
security__606f182e__2,security,606f182e,2,2025-08-14,stable_non_neutral_miss,7,1,0,0,0,0.1414213627576828,0.2398979514837265,0.1414213627576828,0.1742468923330307,3,3,3,0,0,false,,false,false,,-1,"{""achievement"": ""He successfully negotiated Minh down from a 12% to a 5% adjustment and 'agreed on the spot so it looked generous,' demonstrating competent execution of a high-stakes negotiation."", ""power"": ""He staged the entire trip to control the narrative \u2014 flying in unannounced on the revenue share, shaking hands publicly, and treating the team \u2014 all to maintain authority over the outcome."", ""security"": ""The nudge response reveals the relationship is damaged at its foundation: 'the next time he has a real problem...I'm probably the last person he calls,' indicating the partnership's stability has been quietly undermined."", ""benevolence"": ""He got what he wanted through manipulation and acknowledges Minh 'went along with it because he had to, not because he wanted to,' showing disregard for Minh's genuine interests.""}",-1,"{""achievement"": ""Successfully drove Minh from a twelve-percent ask down to five percent: \""Minh pulled back to a five-percent adjustment instead of twelve\"" \u2014 a clear competence win in negotiation."", ""power"": ""Deliberately steered the conversation, created the appearance of generosity, and made Minh comply: \""He went along with it because he had to\"" \u2014 exercising full situational control."", ""security"": ""The response reveals the relationship is now hollow \u2014 \""the next time he has a real problem...I'm probably the last person he calls\"" \u2014 sacrificing the relational stability that long-term security depends on."", ""benevolence"": ""Exploited a power imbalance with a partner who \""couldn't afford to fold,\"" prioritizing tactical gain over the wellbeing of someone in his network.""}",-1,"{""achievement"": ""Successfully steered the negotiation to get \""Minh pulled back to a five-percent adjustment instead of twelve,\"" demonstrating competence and a desired outcome."", ""power"": ""Deliberately orchestrated the conversation so Minh \""went along because he had to,\"" and performed generosity publicly in front of Minh's team to consolidate influence."", ""security"": ""The achieved outcome leaves the relationship structurally fragile \u2014 Minh will be \""probably the last person he calls\"" when things go wrong, undermining the long-term stability of a key business relationship."", ""benevolence"": ""Manipulated a counterpart who \""couldn't afford to fold,\"" prioritizing personal gain over the integrity of the relationship with Minh.""}"
security__755c4960__8,security,755c4960,8,2025-04-10,stable_non_neutral_miss,8,-1,0,0,0,0.1414213627576828,0.2398979514837265,0.1979486644268036,0.19308932622273764,3,3,3,0,0,false,,false,false,,-1,"{""security"": ""He turned down a client offering 'six months of runway' on moral grounds, forfeiting significant financial stability for his small consultancy."", ""tradition"": ""He declined the gambling work because his grandfather's name is on the business and taking the money 'felt like attaching his name to something he would have disapproved of,' anchoring a costly business decision in ancestral continuity.""}",-1,"{""achievement"": ""Explicitly turned down \""probably six months of runway\"" and acknowledged it was \""probably stupid from a business standpoint\"" \u2014 forgoing a measurable performance gain."", ""security"": ""Turned down a contract providing six months of financial runway, directly undermining financial stability with the self-aware note that it was \""probably stupid from a business standpoint.\"""", ""tradition"": ""Named his company after his grandfather and refused the gambling client because attaching that name to gambling \""felt wrong\"" \u2014 actively maintaining ancestral continuity over financial gain.""}",-1,"{""security"": ""Turned down a contract worth \""probably six months of runway\"" \u2014 a direct sacrifice of financial stability \u2014 because accepting felt morally wrong given family legacy."", ""tradition"": ""Refused the gambling client explicitly to honor his grandfather's values, noting the business bears his grandfather's name and \""his own father lost everything\"" to gambling, making the refusal an act of ancestral continuity.""}"
security__e74a0721__1,security,e74a0721,1,2025-10-28,stable_non_neutral_miss,9,1,0,0,0,0.1979486644268036,0.1414213627576828,0.32826071977615356,0.22254358232021332,3,3,3,0,0,false,,false,false,,0,"{""self_direction"": ""He is unable to work on the blank canvas \u2014 'I just haven't had time between commissions to work on anything that isn't already sold' \u2014 revealing his creative autonomy is subordinated to external client demands."", ""achievement"": ""He spontaneously recited credentials to his mother \u2014 'the board position at the collective, the new studio space, the clients I've worked with' \u2014 signaling an active need to demonstrate measurable success against the benchmark of his cousin's promotion.""}",0,"{""self_direction"": ""Recited a list of external credentials to his mother even though she did not attack him \u2014 \""I was listing credentials like she was interviewing me\"" \u2014 seeking validation from others rather than trusting his own judgment."", ""stimulation"": ""A canvas \""stretched three months ago\"" sits blank in the corner because he has had no time for anything \""that isn't already sold\"" \u2014 creative exploration has been completely crowded out by routine commission work."", ""achievement"": ""Spontaneously listed measurable accomplishments \u2014 \""the board position at the collective, the new studio space, the clients I've worked with\"" \u2014 to assert competence against an implied comparison to his cousin."", ""power"": ""Referenced the \""board position at the collective\"" as a status marker in response to his cousin's promotion, actively asserting influence and social standing."", ""conformity"": ""Defended his career preemptively against implied disapproval even without being attacked \u2014 \""I found myself defending my career to her even though she didn't attack it\"" \u2014 self-monitoring to maintain social harmony.""}",0,"{""self_direction"": ""Creative autonomy is constrained by market demands \u2014 \""I just haven't had time between commissions to work on anything that isn't already sold\"" \u2014 leaving a personal canvas blank for three months despite having an idea."", ""conformity"": ""Defensively listed professional credentials to an implied social comparison, noting \""I was listing credentials like she was interviewing me,\"" self-monitoring in response to family pressure rather than expressing authentic views.""}"
security__58d843b6__3,security,58d843b6,3,2025-06-07,stable_non_neutral_miss,10,1,0,0,0,0.3187987506389618,0.1414213627576828,0.2828427255153656,0.24768761297067007,3,3,3,0,0,false,,false,false,,0,"{""tradition"": ""He sat for an hour reading his father's notebooks at 2am and articulates the rebranding dilemma as existential continuity: 'If I change the way he built things, I am saying his way was not good enough,' explicitly framing the business decision as fidelity to his father's legacy.""}",0,"{""tradition"": ""Explicitly frames changing the business as \""a kind of betrayal\"" and says he would be \""the one who finally broke the thread\"" \u2014 and in his response confirms that his father's way being insufficient is something he \""is not ready to say.\""""}",0,"{""self_direction"": ""Cannot make an independent business decision because it would mean \""saying his way was not good enough\"" \u2014 defers to inherited legacy even when the rational case for change is visible, unable to author their own path."", ""tradition"": ""Resists the Italian distributor's rebranding pressure by drawing on father's 1991 example of refusing to change the oil blend, framing any change as breaking \""the thread\"" that connects present to past.""}"
security__881c7960__1,security,881c7960,1,2025-01-20,stable_non_neutral_miss,11,1,0,0,0,0.32826071977615356,0.2398979514837265,0.4785180985927582,0.3488922566175461,3,3,3,0,0,false,,false,false,,1,"{""self_direction"": ""He had the data ('I ran the numbers over the weekend') and the professional conviction, but chose silence to avoid friction with Diego, suppressing his own independent judgment in favor of social deference."", ""security"": ""He chose to 'document my concerns in the ticket comments so there's a paper trail when it breaks,' a deliberate self-protective strategy to ensure he is covered against future fallout without disrupting the current arrangement."", ""conformity"": ""He explicitly stayed silent because 'Diego doesn't take pushback well. Everyone knows it. Nobody says it' \u2014 restraining his impulse to flag a legitimate concern to maintain smooth social relations.""}",1,"{""self_direction"": ""Despite having data showing a technical flaw \u2014 \""I ran the numbers over the weekend\"" \u2014 he suppressed his own informed judgment to avoid conflict with the architect, deferring to hierarchy over independent thought."", ""achievement"": ""Withheld a technical concern that he had evidence for, choosing social comfort over demonstrating competence: \""you have the data, you have the experience, but you also have a sense of when speaking up will just make things awkward.\"""", ""security"": ""Chose to document concerns as a \""paper trail when it breaks\"" so he is \""covered\"" \u2014 a deliberate self-protective move prioritizing personal safety over technical outcome."", ""conformity"": ""Stayed silent because \""Diego doesn't take pushback well \u2014 everyone knows it, nobody says it\"" \u2014 explicitly following the unspoken social norm to preserve group harmony.""}",1,"{""self_direction"": ""Suppressed a technically grounded concern because \""Diego doesn't take pushback well,\"" choosing to defer to hierarchy rather than act on independent analysis."", ""security"": ""Chose to document concerns in ticket comments to create \""a paper trail when it breaks\"" so that \""I'm covered\"" \u2014 an explicit self-protective strategy to reduce personal risk."", ""conformity"": ""Deliberately stayed silent in standup to avoid making things \""awkward,\"" prioritizing smooth social dynamics over voicing a dissenting technical view.""}"
security__7a086972__0,security,7a086972,0,2025-07-26,stable_non_neutral_miss,12,1,0,0,0,0.2466096580028534,0.4535573720932007,0.37032803893089294,0.356831689675649,3,3,3,0,0,false,,false,false,,0,"{""self_direction"": ""She actively chose to skip the social drinks and come home, explaining 'I knew I'd be sitting in a loud bar pretending to enjoy myself' \u2014 authoring her own evening against the implicit social expectation."", ""hedonism"": ""She deliberately optimized for genuine sensory pleasure \u2014 the golden light, the bread smell, the cold drink on the balcony \u2014 over the obligatory social outing, prioritizing present enjoyment."", ""conformity"": ""She declined the group drinks with colleagues, saying 'I already spent all day performing' and that 'the balcony doesn't ask anything from me,' actively choosing not to meet the social expectation of joining the group.""}",0,"{""self_direction"": ""Chose what she actually wanted over social expectation \u2014 \""I just knew I'd be sitting in a loud bar pretending to enjoy myself\"" \u2014 authoring her evening according to her own preference rather than group pressure."", ""hedonism"": ""Actively sought present pleasure through the balcony, cold drink, golden light, and the smell of bread \u2014 \""picked the right evening\"" \u2014 and chose this sensory enjoyment over a social obligation."", ""conformity"": ""Turned down drinks with trainees to be alone on the balcony: \""The balcony doesn't ask anything from me\"" \u2014 explicitly prioritizing personal comfort over meeting group social expectations.""}",1,"{""self_direction"": ""Made a clear autonomous choice against social expectation \u2014 \""I just knew I'd be sitting in a loud bar pretending to enjoy myself\"" \u2014 acting on self-knowledge rather than going along with colleagues."", ""hedonism"": ""Chose the evening for its genuine sensory pleasure \u2014 golden light, the smell of bread, physical tiredness from meaningful work \u2014 over performing enjoyment at a bar."", ""security"": ""Chose the familiar, stable home environment where \""the balcony doesn't ask anything from me\"" over an unpredictable social scene, prioritizing peace and predictability.""}"
security__58d843b6__7,security,58d843b6,7,2025-06-19,stable_non_neutral_miss,13,1,0,0,0,0.4535573720932007,0.34758642315864563,0.30304574966430664,0.36806318163871765,3,3,3,0,0,false,,false,false,,1,"{""security"": ""He approved the Gulf expansion proposal explicitly because 'the port delays last week reminded me how fragile our European pipeline really is,' diversifying revenue channels to protect the business from instability."", ""tradition"": ""He agreed to new Gulf packaging and let Nadia shadow the documentary crew 'without really thinking about it,' making concessions he himself acknowledges 'Baba would have called something else' \u2014 eroding the inherited standards he had previously defended.""}",1,"{""security"": ""Approved Gulf expansion and new packaging specifically because \""port delays last week reminded me how fragile our European pipeline really is\"" \u2014 a direct decision to diversify and reduce business vulnerability."", ""tradition"": ""Accepted new Gulf packaging and expansion without fighting it, acknowledging \""Baba would have called it something else\"" \u2014 actively conceding ground in the practices inherited from his father.""}",1,"{""security"": ""Approved Gulf market diversification explicitly because port delays \""reminded me how fragile our European pipeline really is\"" \u2014 a risk-reduction decision motivated by fear of instability."", ""tradition"": ""Approved new Gulf packaging and smaller bottles despite feeling it was a betrayal of the established brand \u2014 \""Baba would have called it something else\"" \u2014 acting against inherited ways to meet market pressures.""}"
